{
  "schema_version": "1.0.0",
  "fixture_data": true,
  "task_id": "analysis_task_aaaaaaaaaaaaaaaaaaaaaaaaaaaaaaaa",
  "media_task_id": "media_aaaaaaaaaaaaaaaaaaaaaaaaaaaaaaaa",
  "model_purpose": "analysis",
  "status": "completed",
  "progress": 100,
  "current_step": "completed",
  "attempt_count": 1,
  "max_attempts": 2,
  "metric_count": 1,
  "comment_count": 0,
  "ocr_result_path": "fixtures/ocr-result.valid.json",
  "result_path": "fixtures/analysis.valid.json",
  "error": null,
  "created_at": "2026-08-29T06:00:00Z",
  "updated_at": "2026-08-29T06:10:00Z"
}
